{"$schema":"https://json-schema.org/draft/2020-12/schema","$id":"prompt-quality-execution-program.v2","$comment":"completion-authority-contract.v1|task_fields=completion_contract,completion_validation|contract_fields=contract_id,contract_version,task_id,required_changed_paths,required_artifact_paths,required_validation_script_ids,forbidden_changed_paths|claim_fields=validation_status,tested_commit,source,validation_profile,ci_run_reference|authority_sequence=closure>subject>authority_anchor>authority_blobs>preactivated_contract>contract_satisfaction>subject_profile>anchor_ci>subject_ci","title":"Prompt Quality Execution Program v2","type":"object","additionalProperties":false,"required":["$schema","schema_version","program_id","repository","program_status","operating_model","status_authority","evidence_authority","completion_policy","scope_policy","review_policy","tasks"],"$defs":{"non_empty_unique_strings":{"type":"array","minItems":1,"uniqueItems":true,"items":{"type":"string","minLength":1}},"repository_path":{"type":"string","minLength":1,"pattern":"^(?!/)(?!.*\\\\)(?!.*//)(?!.*(?:^|/)\\.\\.(?:/|$))[A-Za-z0-9._-]+(?:/[A-Za-z0-9._-]+)*$"},"completion_contract":{"type":"object","additionalProperties":false,"required":["contract_id","contract_version","task_id","required_changed_paths","required_artifact_paths","required_validation_script_ids","forbidden_changed_paths"],"properties":{"contract_id":{"type":"string","minLength":1},"contract_version":{"type":"integer","minimum":1},"task_id":{"type":"string","pattern":"^PPQR-[0-9]{3}$"},"required_changed_paths":{"type":"array","minItems":1,"uniqueItems":true,"items":{"type":"string","minLength":1,"pattern":"^(?!/)(?!.*\\\\)(?!.*//)(?!.*(?:^|/)\\.\\.(?:/|$))[A-Za-z0-9._-]+(?:/[A-Za-z0-9._-]+)*$"}},"required_artifact_paths":{"type":"array","uniqueItems":true,"items":{"type":"string","minLength":1,"pattern":"^(?!/)(?!.*\\\\)(?!.*//)(?!.*(?:^|/)\\.\\.(?:/|$))[A-Za-z0-9._-]+(?:/[A-Za-z0-9._-]+)*$"}},"required_validation_script_ids":{"type":"array","minItems":1,"uniqueItems":true,"items":{"type":"string","pattern":"^[a-z0-9][a-z0-9:-]*$"}},"forbidden_changed_paths":{"type":"array","uniqueItems":true,"items":{"type":"string","minLength":1,"pattern":"^(?!/)(?!.*\\\\)(?!.*//)(?!.*(?:^|/)\\.\\.(?:/|$))[A-Za-z0-9._-]+(?:/[A-Za-z0-9._-]+)*$"}}}},"validation_claim":{"type":"object","additionalProperties":false,"required":["validation_status","tested_commit","source","validation_profile","ci_run_reference"],"properties":{"validation_status":{"const":"passed"},"tested_commit":{"type":"string","pattern":"^[0-9a-f]{40}$"},"source":{"enum":["github_actions","local"]},"validation_profile":{"const":"peac-canonical-ci.v1"},"ci_run_reference":{"type":["integer","null"],"minimum":1}},"allOf":[{"if":{"properties":{"source":{"const":"github_actions"}},"required":["source"]},"then":{"properties":{"ci_run_reference":{"type":"integer","minimum":1}}},"else":{"properties":{"ci_run_reference":{"type":"null"}}}}]},"task":{"type":"object","additionalProperties":false,"required":["task_id","title","purpose","depends_on","state","blockers","completion_contract","completion_validation"],"properties":{"task_id":{"type":"string","pattern":"^PPQR-[0-9]{3}$"},"title":{"type":"string","minLength":1},"purpose":{"$ref":"#/$defs/non_empty_unique_strings"},"depends_on":{"type":"array","uniqueItems":true,"items":{"type":"string","pattern":"^PPQR-[0-9]{3}$"}},"state":{"enum":["not_started","active","blocked","complete"]},"blockers":{"type":"array","uniqueItems":true,"items":{"type":"string","minLength":1}},"completion_contract":{"oneOf":[{"type":"null"},{"$ref":"#/$defs/completion_contract"}]},"completion_validation":{"oneOf":[{"type":"null"},{"$ref":"#/$defs/validation_claim"}]}},"allOf":[{"if":{"properties":{"state":{"const":"complete"}},"required":["state"]},"then":{"properties":{"completion_contract":{"$ref":"#/$defs/completion_contract"},"completion_validation":{"$ref":"#/$defs/validation_claim"},"blockers":{"maxItems":0,"type":"array"}}},"else":{"properties":{"completion_validation":{"type":"null"}}}},{"if":{"properties":{"state":{"const":"blocked"}},"required":["state"]},"then":{"properties":{"blockers":{"minItems":1,"type":"array"}}},"else":{"properties":{"blockers":{"maxItems":0,"type":"array"}}}}]}},"properties":{"$schema":{"const":"./schemas/prompt-quality-execution-program.v2.schema.json"},"schema_version":{"const":"prompt-quality-execution-program.v2"},"program_id":{"const":"PROMPT-QUALITY-MIGRATION-EXECUTION-PROGRAM"},"repository":{"const":"rezahh107/Prompt-Pipeline"},"program_status":{"const":"active"},"operating_model":{"const":"BALANCED_PERSONAL_REPOSITORY"},"status_authority":{"const":"planning/NEXT_WORK.md"},"evidence_authority":{"type":"object","additionalProperties":false,"required":["commit_identity","history","pull_requests","validation"],"properties":{"commit_identity":{"const":"Git commit SHA"},"history":{"const":"Git history and ancestry"},"pull_requests":{"const":"GitHub PR metadata"},"validation":{"const":"Trusted normalized GitHub Actions and Git evidence"}}},"completion_policy":{"type":"object","additionalProperties":false,"required":["claim_role","authoritative_source","local_evidence","historical_completion_relation"],"properties":{"claim_role":{"const":"non_authoritative_until_verified"},"authoritative_source":{"const":"trusted_normalized_git_and_github_actions"},"local_evidence":{"const":"reporting_only"},"historical_completion_relation":{"const":"current_head_or_ancestor"}}},"scope_policy":{"type":"object","additionalProperties":false,"required":["routine_changes","high_risk_changes"],"properties":{"routine_changes":{"type":"object","additionalProperties":false,"required":["examples","required_controls"],"properties":{"examples":{"$ref":"#/$defs/non_empty_unique_strings"},"required_controls":{"$ref":"#/$defs/non_empty_unique_strings"}}},"high_risk_changes":{"type":"object","additionalProperties":false,"required":["examples","required_controls"],"properties":{"examples":{"$ref":"#/$defs/non_empty_unique_strings"},"required_controls":{"$ref":"#/$defs/non_empty_unique_strings"}}}}},"review_policy":{"type":"object","additionalProperties":false,"required":["routine_low_risk_change","high_risk_or_cross_cutting_change"],"properties":{"routine_low_risk_change":{"const":"advisory_or_sampled"},"high_risk_or_cross_cutting_change":{"const":"independent_review_required"}}},"tasks":{"type":"array","minItems":15,"maxItems":15,"items":{"$ref":"#/$defs/task"}}}}