{"$schema":"./schemas/prompt-quality-execution-program.v2.schema.json","schema_version":"prompt-quality-execution-program.v2","program_id":"PROMPT-QUALITY-MIGRATION-EXECUTION-PROGRAM","repository":"rezahh107/Prompt-Pipeline","program_status":"active","operating_model":"BALANCED_PERSONAL_REPOSITORY","status_authority":"planning/NEXT_WORK.md","evidence_authority":{"commit_identity":"Git commit SHA","history":"Git history and ancestry","pull_requests":"GitHub PR metadata","validation":"Trusted normalized GitHub Actions and Git evidence"},"completion_policy":{"claim_role":"non_authoritative_until_verified","authoritative_source":"trusted_normalized_git_and_github_actions","local_evidence":"reporting_only","historical_completion_relation":"current_head_or_ancestor"},"scope_policy":{"routine_changes":{"examples":["documentation","planning status","ordinary tests and fixtures","prompt templates","non-destructive validator fixes","local refactoring"],"required_controls":["clear PR summary","changed-file review","canonical CI","ordinary review"]},"high_risk_changes":{"examples":["GitHub workflows","public schemas","authentication or authorization","security controls","dependency upgrades","destructive migrations","production routing","release authority","secret handling","repository permissions"],"required_controls":["explicit scope summary","risk statement","rollback or recovery notes","independent review","path-sensitive checks where useful","canonical CI"]}},"review_policy":{"routine_low_risk_change":"advisory_or_sampled","high_risk_or_cross_cutting_change":"independent_review_required"},"tasks":[{"task_id":"PPQR-001","title":"Program Ledger and Legacy Quality Baseline","purpose":["inventory current prompt-generation behavior","inventory entrypoints, domains, rules, templates, artifacts, evaluators, and consumers","record current defects and unsupported claims","establish the legacy quality baseline without claiming improvement"],"depends_on":[],"state":"not_started","blockers":[],"completion_contract":null,"completion_validation":null},{"task_id":"PPQR-002","title":"Canonical Intake and Routing Foundation","purpose":["establish one canonical intake model","establish one routing authority","define route decisions and domain adapter boundaries","preserve bounded legacy delegation"],"depends_on":["PPQR-001"],"state":"not_started","blockers":[],"completion_contract":null,"completion_validation":null},{"task_id":"PPQR-003","title":"Domain Quality Contract Foundation","purpose":["establish JSON Schema-first domain contracts","separate required, optional, conditional, forbidden, and clarification semantics","define trust boundaries and output obligations","prohibit silent critical defaults"],"depends_on":["PPQR-001"],"state":"not_started","blockers":[],"completion_contract":null,"completion_validation":null},{"task_id":"PPQR-004","title":"Executable Rule Manifest Foundation","purpose":["define rule manifests","define applicability, carriers, validators, mutations, diagnostics, and gates","create rule-coverage reporting","distinguish prose-only, prompt-only, validated, and enforced states"],"depends_on":["PPQR-003"],"state":"not_started","blockers":[],"completion_contract":null,"completion_validation":null},{"task_id":"PPQR-005","title":"Thin Template and Traceability Foundation","purpose":["define template manifests","separate presentation authority from contract and rule authority","trace output sections to inputs, rules, or obligations","detect unauthorized template semantics"],"depends_on":["PPQR-003","PPQR-004"],"state":"not_started","blockers":[],"completion_contract":null,"completion_validation":null},{"task_id":"PPQR-006","title":"First Domain Quality Pack","purpose":["create the first complete domain quality pack","establish development, release, and regression corpora","create critical mutation tests","establish a legacy quality baseline"],"depends_on":["PPQR-001","PPQR-003","PPQR-004","PPQR-005"],"state":"not_started","blockers":[],"completion_contract":null,"completion_validation":null},{"task_id":"PPQR-007","title":"Native Quality Kernel","purpose":["implement repository-native schema validation","implement rule coverage and template traceability","implement mutation execution and metric aggregation","avoid unnecessary abstraction layers"],"depends_on":["PPQR-003","PPQR-004","PPQR-006"],"state":"not_started","blockers":[],"completion_contract":null,"completion_validation":null},{"task_id":"PPQR-008","title":"Pluggable Evaluation Harness","purpose":["implement an execution-only harness adapter","pin harness identity","normalize raw execution results","preserve repository-owned authority"],"depends_on":["PPQR-006","PPQR-007"],"state":"not_started","blockers":[],"completion_contract":null,"completion_validation":null},{"task_id":"PPQR-009","title":"Model Profiles and Risk-Tiered Semantic Evaluation","purpose":["establish model capability profiles","establish execution-profile identity","define risk-tier selection","implement semantic evaluation as non-blocking","define calibration prerequisites"],"depends_on":["PPQR-006","PPQR-007","PPQR-008"],"state":"not_started","blockers":[],"completion_contract":null,"completion_validation":null},{"task_id":"PPQR-010","title":"Quality Delta and Migration Promotion Gate","purpose":["compare legacy and candidate pipelines using held-out evidence","prohibit critical regression","establish Migration Promotion Gate as sole transition authority","enforce one production-authoritative path"],"depends_on":["PPQR-006","PPQR-007","PPQR-008","PPQR-009"],"state":"not_started","blockers":[],"completion_contract":null,"completion_validation":null},{"task_id":"PPQR-011","title":"First Domain Cutover","purpose":["route the first domain through the new path","preserve bounded rollback","prove non-regression or improvement","remove compatibility code only after new_only"],"depends_on":["PPQR-002","PPQR-006","PPQR-007","PPQR-008","PPQR-010"],"state":"not_started","blockers":[],"completion_contract":null,"completion_validation":null},{"task_id":"PPQR-012","title":"Second-Domain Generality Proof","purpose":["prove the architecture is not overfit to repo_review","use a materially different domain","prevent domain-specific assumptions from becoming global"],"depends_on":["PPQR-011"],"state":"not_started","blockers":[],"completion_contract":null,"completion_validation":null},{"task_id":"PPQR-013","title":"High-Risk Image Quality Pack and Selective Shadow","purpose":["implement protected-versus-editable semantics","define identity-preservation obligations","create adversarial and metamorphic tests","implement selective shadow and rollback evidence"],"depends_on":["PPQR-009","PPQR-010","PPQR-012"],"state":"not_started","blockers":[],"completion_contract":null,"completion_validation":null},{"task_id":"PPQR-014","title":"Remaining Domain Migration Program","purpose":["migrate remaining bounded domains","require one quality pack and Quality Delta evidence per promotion","avoid universal abstractions","preserve independent rollback boundaries"],"depends_on":["PPQR-012","PPQR-013"],"state":"not_started","blockers":[],"completion_contract":null,"completion_validation":null},{"task_id":"PPQR-015","title":"General Fallback Migration and Legacy Retirement","purpose":["migrate general.default last","verify routing ambiguity and fallback behavior","retire legacy paths only when safe","confirm no hidden consumers remain"],"depends_on":["PPQR-014"],"state":"not_started","blockers":[],"completion_contract":null,"completion_validation":null}]}